,name,seed_protein,description,rmsd,aligned_residue,seed_protein_total_residues,sequence_id
0,5BPEA,1L1NA,Crystal Structure Of Ev71 3cpro In Complex With A Potent And Selective Inhibitor,0.9,176,183,59.1
1,2J92A,1L1NA,3c Protease From Type A10(61) Foot-And-Mouth Disease Virus- Crystal Packing Mutant (K51q),2.1,172,183,20.9
2,5HM2E,1L1NA,Crystal Structure Of The 3c Protease From South African Territories Type 2 Foot-and-mouth Disease Virus,2.0,167,183,19.8
3,2XYAA,1L1NA,Non-Covalent Inhibtors Of Rhinovirus 3c Protease,1.2,166,183,44.0
4,2HALA,1L1NA,An Episulfide Cation (Thiiranium Ring) Trapped In The Active Site Of Hav 3c Proteinase Inactivated By Peptide-Based Ketone Inhibitors,2.2,165,183,18.2
5,3K6YA,1L1NA,"Crystal Structure Of Rv3671c Protease From M. Tuberculosis, Active Form",2.8,160,183,11.9
6,5HMAA,1L1NA,Crystal Structure Of Mamo Protease Domain From Magnetospirillum Magneticum (ni Bound Form),2.7,159,183,12.6
7,1L1JA,1L1NA,Crystal Structure Of The Protease Domain Of An Atp- Independent Heat Shock Protease Htra,3.0,158,183,13.9
8,1AGJA,1L1NA,Epidermolytic Toxin A From Staphylococcus Aureus,3.0,155,183,13.5
9,3LGIB,1L1NA,Structure Of The Protease Domain Of Degs (Degs-Deltapdz) At 1.65 A,2.9,153,183,13.7
10,1WCZA,1L1NA,Crystal Structure Of An Alkaline Form Of V8 Protease From Staphylococcus Aureus,3.0,152,183,10.5
11,2H5CA,1L1NA,0.82a Resolution Crystal Structure Of Alpha-Lytic Protease At Ph 5,2.9,152,183,12.5
12,2OQ5A,1L1NA,"Crystal Structure Of Desc1, A New Member Of The Type Ii Transmembrane Serine Proteinases Family",3.1,151,183,10.6
13,5AVDA,1L1NA,The 0.86 Angstrom Structure Of Elastase Crystallized In High-strength Agarose Hydrogel,3.0,151,183,9.9
14,2OLGA,1L1NA,Crystal Structure Of The Serine Protease Domain Of Prophenoloxidase Activating Factor-I In A Zymogen Form,3.1,150,183,12.7
15,4FLNA,1L1NA,Crystal Structure Of Plant Protease Deg2,2.6,150,183,9.3
16,1ARBA,1L1NA,"The Primary Structure And Structural Characteristics Of Achromobacter Lyticus Protease I, A Lysine-Specific Serine Protease",2.5,149,183,13.4
17,1LVMA,1L1NA,Catalytically Active Tobacco Etch Virus Protease Complexed With Product,2.6,149,183,12.8
18,3WOOA,1L1NA,Crystal Structure Of The Dap Bii Hexapeptide Complex I,3.2,149,183,10.1
19,3H7TA,1L1NA,Crystal Structure Of Scabies Mite Inactivated Protease Paralogue S-D1 (Smipp-S-D1),2.8,148,183,12.8
20,1M9UA,1L1NA,Crystal Structure Of Earthworm Fibrinolytic Enzyme Component A From Eisenia Fetida,2.9,147,183,10.2
21,2OUAA,1L1NA,Crystal Structure Of Nocardiopsis Protease (Napase),2.8,147,183,10.9
22,1EAXA,1L1NA,Crystal Structure Of Mtsp1 (Matriptase),2.8,146,183,11.6
23,1TE0B,1L1NA,"Structural Analysis Of Degs, A Stress Sensor Of The Bacterial Periplasm",2.9,146,183,15.1
24,5DGJA,1L1NA,"1.0a Resolution Structure Of Norovirus 3cl Protease In Complex An Oxadiazole-based, Cell Permeable Macrocyclic (20-mer) Inhibitor",2.9,146,183,13.7
25,1AZZA,1L1NA,Fiddler Crab Collagenase Complexed To Ecotin,2.6,145,183,11.7
26,1PQ7A,1L1NA,"Trypsin At 0.8 A, Ph5  BORAX",2.7,145,183,15.9
27,1P3CA,1L1NA,Glutamyl Endopeptidase From Bacillus Intermedius,2.8,145,183,13.8
28,2QA9E,1L1NA,Crystal Structure Of The Second Tetrahedral Intermediates Of Sgpb At Ph 4.2,2.5,145,183,13.8
29,4MNWA,1L1NA,Crystal Structure Of Urokinase-type Plasminogen Activator (upa) Complexed With Bicyclic Peptide Uk749,3.0,145,183,12.4
30,3WY8A,1L1NA,Crystal Structure Of Protease Anisep From Arthrobacter Nicotinovorans,3.0,145,183,8.3
31,1DDJA,1L1NA,Crystal Structure Of Human Plasminogen Catalytic Domain,2.9,144,183,13.9
32,4XSKU,1L1NA,"Structure Of Paitrap, An Upa Mutant",2.9,144,183,13.2
33,2AIQA,1L1NA,Crystal Structure Of Benzamidine-Inhibited Protein C Activator From The Venom Of Copperhead Snake Agkistrodon Contortrix Contortrix,2.6,143,183,15.4
34,3UFAA,1L1NA,Crystal Structure Of The Staphylococcal Serine Protease Spla In Complex With A Specific Phosphonate Inhibitor,2.7,143,183,11.2
35,3H7OA,1L1NA,Crystal Structure Of Scabies Mite Inactivated Protease Paralogue S-I1 (Smipp-S-I1),2.5,142,183,12.0
36,2W5EA,1L1NA,Structural And Biochemical Analysis Of Human Pathogenic Astrovirus Serine Protease At 2.0 Angstrom Resolution,2.4,141,183,17.0
37,2XW9A,1L1NA,Crystal Structure Of Complement Factor D Mutant S183a,2.9,141,183,10.6
38,4I8HA,1L1NA,Bovine Trypsin At 0.75 Resolution,2.7,140,183,15.0
39,5HU6C,1L1NA,Structure Of The T. Brucei Haptoglobin-haemoglobin Receptor Bound To Human Haptolgobin-haemoglobin,2.7,139,183,11.5
40,2HLCA,1L1NA,Hl Collagenase Structure At 1.7a Resolution,2.8,138,183,10.9
41,2F91A,1L1NA,"1.2a Resolution Structure Of A Crayfish Trypsin Complexed With A Peptide Inhibitor, Sgti",2.6,138,183,15.2
42,4FXGH,1L1NA,Complement C4 In Complex With Masp-2,2.7,137,183,16.8
43,4LK4A,1L1NA,Structure Of Vibrio Cholerae Vesb Protease,2.6,136,183,13.2
44,4WMEA,1L1NA,Crystal Structure Of Catalytically Inactive Mers-cov 3cl Protease (c148a) In Spacegroup C2,2.7,136,183,11.0
45,5EU8A,1L1NA,Structure Of Fipv Main Protease In Complex With Dual Inhibitors,2.7,136,183,14.0
46,2QXIA,1L1NA,High Resolution Structure Of Human Kallikrein 7 In Complex With Suc-Ala-Ala-Pro-Phe-Chloromethylketone,2.4,135,183,13.3
47,3BEUA,1L1NA,Na+-Dependent Allostery Mediates Coagulation Factor Protease Active Site Selectivity,2.4,135,183,11.9
48,4XFQA,1L1NA,Crystal Structure Basis For Pedv 3c Like Protease,2.7,135,183,9.6
49,1VZQH,1L1NA,Complex Of Thrombin With Designed Inhibitor 7165,2.7,133,183,12.8
50,4Z6AH,1L1NA,Crystal Structure Of A Fviia-trypsin Chimera (yt) In Complex With Soluble Tissue Factor,2.7,132,183,9.8
51,4RI0A,1L1NA,"Serine Protease Htra3, Mutationally Inactivated",2.3,130,183,13.8
52,4X2VB,1L1NA,Crystal Structure Of The Murine Norovirus Ns6 Protease (inactive C139a Mutant) With A C-terminal Extension To Include Residue P1 Prime Of Ns7,2.6,130,183,16.2
53,4ZROA,1L1NA,2.1 A X-ray Structure Of Fipv-3clpro Bound To Covalent Inhibitor,2.3,130,183,13.8
54,1ZYOA,1L1NA,Crystal Structure Of The Serine Protease Domain Of Sesbania Mosaic Virus Polyprotein,2.6,129,183,17.1
55,3F1SB,1L1NA,Crystal Structure Of Protein Z Complexed With Protein Z- Dependent Inhibitor,2.5,127,183,13.4
56,1EQ9A,1L1NA,Crystal Structure Of Fire Ant Chymotrypsin Complexed To Pmsf,2.3,124,183,12.1
57,4WVPE,1L1NA,Crystal Structure Of An Activity-based Probe Hne Complex,2.2,123,183,12.2
58,3TVJB,1L1NA,Catalytic Fragment Of Masp-2 In Complex With Its Specific Inhibitor Developed By Directed Evolution On Sgci Scaffold,2.3,122,183,18.9
59,5EDMA,1L1NA,Crystal Structure Of Prothrombin Deletion Mutant Residues 154-167 ( Form I ),2.5,122,183,14.8
60,3NXPA,1L1NA,Crystal Structure Of Human Prethrombin-1,2.4,121,183,14.0
61,1FIZA,1L1NA,Three Dimensional Structure Of Beta-Acrosin From Boar Spermatozoa,2.2,119,183,13.4
62,2GGVB,1L1NA,"Crystal Structure Of The West Nile Virus Ns2b-Ns3 Protease, His51ala Mutant",2.4,119,183,12.6
63,2QV1B,1L1NA,Crystal Structure Of Hcv Ns3-4a V36m Mutant,2.3,118,183,12.7
64,4MG3B,1L1NA,Crystal Structural Analysis Of 2a Protease From Coxsackievirus A16,2.4,116,183,15.5
65,5EPNA,1L1NA,Crystal Structure Of Hcv Ns3/4a Protease In Complex With 5172-mcp1p3 (mk-5172 P1-p3 Macrocyclic Analogue),2.4,116,183,12.9
66,5EPYA,1L1NA,Crystal Structure Of Hcv Ns3/4a Protease A156t Variant In Complex With 5172-mcp1p3 (mk-5172 P1-p3 Macrocyclic Analogue),2.2,116,183,12.9
67,4AFQA,1L1NA,Human Chymase - Fynomer Complex,2.0,112,183,15.2
68,1VCPA,1L1NA,Semliki Forest Virus Capsid Protein (Crystal Form I),2.9,111,183,15.3
69,2HRVA,1L1NA,2a Cysteine Proteinase From Human Rhinovirus 2,2.1,106,183,20.8
70,2Z9IA,5BPEA,Crystal Structure Of Rv0983 From Mycobacterium Tuberculosis- Proteolytically Active Form,2.8,160,180,8.7
71,1TE0A,5BPEA,"Structural Analysis Of Degs, A Stress Sensor Of The Bacterial Periplasm",2.9,152,180,11.2
72,4JCNA,5BPEA,"Structure Of Esp, Serine Protease From Staphylococcus Epidermidis",2.7,148,180,14.2
73,2B9LA,5HMAA,Crystal Structure Of Prophenoloxidase Activating Factor-Ii From The Beetle Holotrichia Diomphalia,3.1,164,191,15.2
74,4A5TS,5HMAA,Structural Basis For The Conformational Modulation,2.9,160,191,19.4
75,3WOKA,5HMAA,Crystal Structure Of The Dap Bii (space),2.3,158,191,19.6
76,3BN9A,2OQ5A,Crystal Structure Of Mt-Sp1 In Complex With Fab Inhibitor E2,1.1,227,232,48.5
77,5EDKA,2OQ5A,Crystal Structure Of Prothrombin Deletion Mutant Residues 146-167 ( Form Ii ),2.1,209,232,34.9
78,2XXLA,2OLGA,Crystal Structure Of Drosophila Grass Clip Serine Protease Of Toll Pathway,2.4,244,278,38.1
79,2XWBF,3H7TA,Crystal Structure Of Complement C3b In Complex With Factors B And D,2.0,189,235,20.1
80,4CR9A,1EAXA,Creating Novel F1 Inhibitors Through Fragment Based Lead Generation And Structure Aided Drug Design,1.2,225,241,40.4
81,3CP7A,3WY8A,Crystal Structure Of A Thermostable Serine Protease Al20 From Extremophilic Microoganism,1.1,209,219,52.6
82,4INKA,3UFAA,Crystal Structure Of Spld Protease From Staphylococcus Aureus At 1.56 A Resolution,1.3,192,200,46.9
83,1MBMA,2W5EA,Nsp4 Proteinase From Equine Arteritis Virus,2.4,133,163,17.3
84,1YM0A,2F91A,"Crystal Structure Of Earthworm Fibrinolytic Enzyme Component B: A Novel, Glycosylated Two-Chained Trypsin",1.5,231,237,42.0
85,3S9CA,2QXIA,"Russell's Viper Venom Serine Proteinase, Rvv-V In Complex With The Fragment (Residues 1533-1546) Of Human Factor V",1.6,214,224,34.1
86,2BZ6H,1VZQH,Orally Available Factor7a Inhibitor,1.6,234,250,35.9
87,1WQSA,4X2VB,Crystal Structure Of Norovirus 3c-Like Protease,1.9,169,185,58.6
88,2XRCB,1EQ9A,Human Complement Factor I,2.3,178,222,25.8
89,3GOVB,3TVJB,Crystal Structure Of The Catalytic Region Of Human Masp-1,1.2,222,242,36.9
90,1FIWA,1FIZA,Three-Dimensional Structure Of Beta-Acrosin From Ram Spermatozoa,0.9,260,263,81.5
91,2VBCA,2GGVB,Crystal Structure Of The Ns3 Protease-Helicase From Dengue Virus,1.1,150,185,58.0
92,1CU1A,2QV1B,Crystal Structure Of An Enzyme Complex From Hepatitis C Virus,1.0,181,181,87.8
93,1WYKA,1VCPA,Sindbis Virus Capsid Protein (114-264),0.8,149,149,68.5
94,4NSVA,1VCPA,Lysobacter Enzymogenes Lysc Endoproteinase K30r Mutant Covalently Inhibited By Tlck,3.5,131,149,13.0
95,2R3UA,1VCPA,Crystal Structure Of The Pdz Deletion Mutant Of Degs,3.0,126,149,12.7
96,1PQAA,1VCPA,Trypsin With Pmsf At Atomic Resolution,3.1,125,149,16.0
97,1BIOA,1VCPA,Human Complement Factor D In Complex With Isatoic Anhydride Inhibitor,3.1,123,149,16.3
98,1GVLA,1VCPA,Human Prokallikrein 6 (Hk6) PROZYME PROPROTEASE M Proneurosin,3.4,122,149,10.7
99,2CGAA,1VCPA,Chymotrypsinogen A,3.3,121,149,18.2
100,4K3JA,4JCNA,Crystal Structure Of Onartuzumab Fab In Complex With Met And Hgf-beta,2.2,181,216,12.2
101,4WJG2,4JCNA,Structure Of T. Brucei Haptoglobin-hemoglobin Receptor Binding To Human Haptoglobin-hemoglobin,2.1,179,216,12.8
102,4CBNA,4JCNA,Crystal Structure Of Complement Factor D Mutant R202a After Conventional Refinement,2.2,177,216,14.7
103,4IBLH,4JCNA,Rubidium Sites In Blood Coagulation Factor Viia,2.2,176,216,12.5
104,4M7GA,4JCNA,Streptomyces Erythraeus Trypsin,2.2,173,216,15.0
105,3FANA,1MBMA,Crystal Structure Of Chymotrypsin-Like ProteasePROTEINASE (3clspNSP4) OF PORCINE REPRODUCTIVE AND RESPIRATORY Syndrome Virus (Prrsv),3.1,173,198,35.3
106,3QO6B,1WYKA,Crystal Structure Analysis Of The Plant Protease Deg1,3.2,129,152,11.6
107,4NSYB,1WYKA,Wild-type Lysobacter Enzymogenes Lysc Endoproteinase Covalently Inhibited By Tlck,3.5,129,152,10.9
108,1DUAA,1WYKA,Crystal Structure Of Exfoliative Toxin A,3.2,128,152,10.9
109,2AYWA,1WYKA,Crystal Structure Of The Complex Formed Between Trypsin And A Designed Synthetic Highly Potent Inhibitor In The Presence Of Benzamidine At 0.97 A Resolution,3.1,125,152,13.6
110,1FY4A,1WYKA,Fusarium Oxysporum Trypsin At Atomic Resolution,3.1,122,152,16.4
